[
  {
    "id": "EDGE-COMPONENT-10001-VALIDATED_BY_SCHEMA-SCHEMA-COMPONENT",
    "predicate": "VALIDATED_BY_SCHEMA",
    "sourceId": "COMPONENT-10001",
    "targetId": "SCHEMA-COMPONENT",
    "sourceDataFile": "data/components/keyword-retriever.json",
    "properties": {
      "declaredInManifest": "data/manifest.json",
      "edgeKind": "Export Provenance",
      "schema": "schema/component.schema.json"
    }
  },
  {
    "id": "EDGE-COMPONENT-10002-VALIDATED_BY_SCHEMA-SCHEMA-COMPONENT",
    "predicate": "VALIDATED_BY_SCHEMA",
    "sourceId": "COMPONENT-10002",
    "targetId": "SCHEMA-COMPONENT",
    "sourceDataFile": "data/components/semantic-retriever.json",
    "properties": {
      "declaredInManifest": "data/manifest.json",
      "edgeKind": "Export Provenance",
      "schema": "schema/component.schema.json"
    }
  },
  {
    "id": "EDGE-COMPONENT-10003-VALIDATED_BY_SCHEMA-SCHEMA-COMPONENT",
    "predicate": "VALIDATED_BY_SCHEMA",
    "sourceId": "COMPONENT-10003",
    "targetId": "SCHEMA-COMPONENT",
    "sourceDataFile": "data/components/rank-fusion.json",
    "properties": {
      "declaredInManifest": "data/manifest.json",
      "edgeKind": "Export Provenance",
      "schema": "schema/component.schema.json"
    }
  },
  {
    "id": "EDGE-COMPONENT-10004-VALIDATED_BY_SCHEMA-SCHEMA-COMPONENT",
    "predicate": "VALIDATED_BY_SCHEMA",
    "sourceId": "COMPONENT-10004",
    "targetId": "SCHEMA-COMPONENT",
    "sourceDataFile": "data/components/cross-encoder-reranker.json",
    "properties": {
      "declaredInManifest": "data/manifest.json",
      "edgeKind": "Export Provenance",
      "schema": "schema/component.schema.json"
    }
  },
  {
    "id": "EDGE-RERANKER-10001-VALIDATED_BY_SCHEMA-SCHEMA-RERANKER",
    "predicate": "VALIDATED_BY_SCHEMA",
    "sourceId": "RERANKER-10001",
    "targetId": "SCHEMA-RERANKER",
    "sourceDataFile": "data/rerankers/cross-encoder-reranker.json",
    "properties": {
      "declaredInManifest": "data/manifest.json",
      "edgeKind": "Export Provenance",
      "schema": "schema/reranker.schema.json"
    }
  },
  {
    "id": "EDGE-RETRIEVER-10001-VALIDATED_BY_SCHEMA-SCHEMA-RETRIEVER",
    "predicate": "VALIDATED_BY_SCHEMA",
    "sourceId": "RETRIEVER-10001",
    "targetId": "SCHEMA-RETRIEVER",
    "sourceDataFile": "data/retrievers/lexical-retriever.json",
    "properties": {
      "declaredInManifest": "data/manifest.json",
      "edgeKind": "Export Provenance",
      "schema": "schema/retriever.schema.json"
    }
  },
  {
    "id": "EDGE-RETRIEVER-10002-VALIDATED_BY_SCHEMA-SCHEMA-RETRIEVER",
    "predicate": "VALIDATED_BY_SCHEMA",
    "sourceId": "RETRIEVER-10002",
    "targetId": "SCHEMA-RETRIEVER",
    "sourceDataFile": "data/retrievers/embedding-retriever.json",
    "properties": {
      "declaredInManifest": "data/manifest.json",
      "edgeKind": "Export Provenance",
      "schema": "schema/retriever.schema.json"
    }
  },
  {
    "id": "EDGE-TECHNIQUE-10001-VALIDATED_BY_SCHEMA-SCHEMA-RAG_TECHNIQUE",
    "predicate": "VALIDATED_BY_SCHEMA",
    "sourceId": "TECHNIQUE-10001",
    "targetId": "SCHEMA-RAG_TECHNIQUE",
    "sourceDataFile": "data/rag-techniques/hybrid-retrieval.json",
    "properties": {
      "declaredInManifest": "data/manifest.json",
      "edgeKind": "Export Provenance",
      "schema": "schema/rag-technique.schema.json"
    }
  },
  {
    "id": "EDGE-TECHNIQUE-10002-VALIDATED_BY_SCHEMA-SCHEMA-RAG_TECHNIQUE",
    "predicate": "VALIDATED_BY_SCHEMA",
    "sourceId": "TECHNIQUE-10002",
    "targetId": "SCHEMA-RAG_TECHNIQUE",
    "sourceDataFile": "data/rag-techniques/query-rewriting.json",
    "properties": {
      "declaredInManifest": "data/manifest.json",
      "edgeKind": "Export Provenance",
      "schema": "schema/rag-technique.schema.json"
    }
  },
  {
    "id": "EDGE-TECHNIQUE-10003-VALIDATED_BY_SCHEMA-SCHEMA-RAG_TECHNIQUE",
    "predicate": "VALIDATED_BY_SCHEMA",
    "sourceId": "TECHNIQUE-10003",
    "targetId": "SCHEMA-RAG_TECHNIQUE",
    "sourceDataFile": "data/rag-techniques/reranking.json",
    "properties": {
      "declaredInManifest": "data/manifest.json",
      "edgeKind": "Export Provenance",
      "schema": "schema/rag-technique.schema.json"
    }
  },
  {
    "id": "EDGE-TECHNIQUE-10004-VALIDATED_BY_SCHEMA-SCHEMA-RAG_TECHNIQUE",
    "predicate": "VALIDATED_BY_SCHEMA",
    "sourceId": "TECHNIQUE-10004",
    "targetId": "SCHEMA-RAG_TECHNIQUE",
    "sourceDataFile": "data/rag-techniques/fixed-size-chunking.json",
    "properties": {
      "declaredInManifest": "data/manifest.json",
      "edgeKind": "Export Provenance",
      "schema": "schema/rag-technique.schema.json"
    }
  },
  {
    "id": "EDGE-TECHNIQUE-10005-VALIDATED_BY_SCHEMA-SCHEMA-RAG_TECHNIQUE",
    "predicate": "VALIDATED_BY_SCHEMA",
    "sourceId": "TECHNIQUE-10005",
    "targetId": "SCHEMA-RAG_TECHNIQUE",
    "sourceDataFile": "data/rag-techniques/recursive-chunking.json",
    "properties": {
      "declaredInManifest": "data/manifest.json",
      "edgeKind": "Export Provenance",
      "schema": "schema/rag-technique.schema.json"
    }
  },
  {
    "id": "EDGE-TECHNIQUE-10006-VALIDATED_BY_SCHEMA-SCHEMA-RAG_TECHNIQUE",
    "predicate": "VALIDATED_BY_SCHEMA",
    "sourceId": "TECHNIQUE-10006",
    "targetId": "SCHEMA-RAG_TECHNIQUE",
    "sourceDataFile": "data/rag-techniques/semantic-chunking.json",
    "properties": {
      "declaredInManifest": "data/manifest.json",
      "edgeKind": "Export Provenance",
      "schema": "schema/rag-technique.schema.json"
    }
  },
  {
    "id": "EDGE-VECTOR-DATABASE-10001-VALIDATED_BY_SCHEMA-SCHEMA-VECTOR_DATABASE",
    "predicate": "VALIDATED_BY_SCHEMA",
    "sourceId": "VECTOR-DATABASE-10001",
    "targetId": "SCHEMA-VECTOR_DATABASE",
    "sourceDataFile": "data/vector-databases/pgvector.json",
    "properties": {
      "declaredInManifest": "data/manifest.json",
      "edgeKind": "Export Provenance",
      "schema": "schema/vector-database.schema.json"
    }
  },
  {
    "id": "EDGE-VECTOR-DATABASE-10002-VALIDATED_BY_SCHEMA-SCHEMA-VECTOR_DATABASE",
    "predicate": "VALIDATED_BY_SCHEMA",
    "sourceId": "VECTOR-DATABASE-10002",
    "targetId": "SCHEMA-VECTOR_DATABASE",
    "sourceDataFile": "data/vector-databases/qdrant.json",
    "properties": {
      "declaredInManifest": "data/manifest.json",
      "edgeKind": "Export Provenance",
      "schema": "schema/vector-database.schema.json"
    }
  },
  {
    "id": "EDGE-VECTOR-DATABASE-10003-VALIDATED_BY_SCHEMA-SCHEMA-VECTOR_DATABASE",
    "predicate": "VALIDATED_BY_SCHEMA",
    "sourceId": "VECTOR-DATABASE-10003",
    "targetId": "SCHEMA-VECTOR_DATABASE",
    "sourceDataFile": "data/vector-databases/weaviate.json",
    "properties": {
      "declaredInManifest": "data/manifest.json",
      "edgeKind": "Export Provenance",
      "schema": "schema/vector-database.schema.json"
    }
  },
  {
    "id": "EDGE-VECTOR-DATABASE-10004-VALIDATED_BY_SCHEMA-SCHEMA-VECTOR_DATABASE",
    "predicate": "VALIDATED_BY_SCHEMA",
    "sourceId": "VECTOR-DATABASE-10004",
    "targetId": "SCHEMA-VECTOR_DATABASE",
    "sourceDataFile": "data/vector-databases/milvus.json",
    "properties": {
      "declaredInManifest": "data/manifest.json",
      "edgeKind": "Export Provenance",
      "schema": "schema/vector-database.schema.json"
    }
  },
  {
    "id": "EDGE-VECTOR-DATABASE-10005-VALIDATED_BY_SCHEMA-SCHEMA-VECTOR_DATABASE",
    "predicate": "VALIDATED_BY_SCHEMA",
    "sourceId": "VECTOR-DATABASE-10005",
    "targetId": "SCHEMA-VECTOR_DATABASE",
    "sourceDataFile": "data/vector-databases/pinecone.json",
    "properties": {
      "declaredInManifest": "data/manifest.json",
      "edgeKind": "Export Provenance",
      "schema": "schema/vector-database.schema.json"
    }
  },
  {
    "id": "EDGE-VECTOR-DATABASE-10006-VALIDATED_BY_SCHEMA-SCHEMA-VECTOR_DATABASE",
    "predicate": "VALIDATED_BY_SCHEMA",
    "sourceId": "VECTOR-DATABASE-10006",
    "targetId": "SCHEMA-VECTOR_DATABASE",
    "sourceDataFile": "data/vector-databases/chroma.json",
    "properties": {
      "declaredInManifest": "data/manifest.json",
      "edgeKind": "Export Provenance",
      "schema": "schema/vector-database.schema.json"
    }
  },
  {
    "id": "EDGE-VECTOR-DATABASE-10007-VALIDATED_BY_SCHEMA-SCHEMA-VECTOR_DATABASE",
    "predicate": "VALIDATED_BY_SCHEMA",
    "sourceId": "VECTOR-DATABASE-10007",
    "targetId": "SCHEMA-VECTOR_DATABASE",
    "sourceDataFile": "data/vector-databases/elasticsearch.json",
    "properties": {
      "declaredInManifest": "data/manifest.json",
      "edgeKind": "Export Provenance",
      "schema": "schema/vector-database.schema.json"
    }
  },
  {
    "id": "EDGE-VECTOR-DATABASE-10008-VALIDATED_BY_SCHEMA-SCHEMA-VECTOR_DATABASE",
    "predicate": "VALIDATED_BY_SCHEMA",
    "sourceId": "VECTOR-DATABASE-10008",
    "targetId": "SCHEMA-VECTOR_DATABASE",
    "sourceDataFile": "data/vector-databases/opensearch.json",
    "properties": {
      "declaredInManifest": "data/manifest.json",
      "edgeKind": "Export Provenance",
      "schema": "schema/vector-database.schema.json"
    }
  },
  {
    "id": "EDGE-VECTOR-DATABASE-10009-VALIDATED_BY_SCHEMA-SCHEMA-VECTOR_DATABASE",
    "predicate": "VALIDATED_BY_SCHEMA",
    "sourceId": "VECTOR-DATABASE-10009",
    "targetId": "SCHEMA-VECTOR_DATABASE",
    "sourceDataFile": "data/vector-databases/redis.json",
    "properties": {
      "declaredInManifest": "data/manifest.json",
      "edgeKind": "Export Provenance",
      "schema": "schema/vector-database.schema.json"
    }
  },
  {
    "id": "EDGE-VECTOR-DATABASE-10010-VALIDATED_BY_SCHEMA-SCHEMA-VECTOR_DATABASE",
    "predicate": "VALIDATED_BY_SCHEMA",
    "sourceId": "VECTOR-DATABASE-10010",
    "targetId": "SCHEMA-VECTOR_DATABASE",
    "sourceDataFile": "data/vector-databases/mongodb.json",
    "properties": {
      "declaredInManifest": "data/manifest.json",
      "edgeKind": "Export Provenance",
      "schema": "schema/vector-database.schema.json"
    }
  },
  {
    "id": "RELATIONSHIP-10001",